987.0,"FOOD AND NUTRITION SECURITY","Analysis of human gastrointestinal microbial diversity by molecular methods and applications of metagenomics for isolation of novel bacteriocins [BT/PR-14977/FNS/20/512/2010]","Dr. Banwari  Lal
The Energy And Resources Institute, New Delhi New Delhi, Delhi-110003","29/08/2011","3 Years 0 Month",10258200.0
988.0,"FOOD AND NUTRITION SECURITY","Iodine status of pregnant mothers, school age children and neonatal thyroid stimulating hormone concentration in three   regions of Himachal Pradesh, India [BT/PR15435/FNS/20/521/2011]","Dr. Umesh  Kapil
All India Institute Of Medical Sciences New Delhi, Delhi-110029","30/08/2011","2 Years 0 Month",6166600.0
989.0,"FOOD AND NUTRITION SECURITY","Isolation and characterization of food derived iron binding peptides and their effect on iron bioavailability: A proteomic approach [BT/PR5228/FNS/20/549/2012]","Dr. Raghu  Pullakhandam
National Institute of Nutrition Hyderabad, Andhra Pradesh-500007","30/08/2012","3 Years 0 Month",3232800.0
990.0,"FOOD AND NUTRITION SECURITY","urther investigations into “Nutrient Mediated Teratogenesis” : Role of 1-C metabolism, vitamin B12 and folate in fetal programming of diabetes and cardiovascular disease [BT/PR-14163/FNS/20/449/2010]","Dr. Chitaranjan S Yagnik
KEM Hospital Research Centre, Pune Pune, Maharashtra-411011","31/08/2010","3 Years 0 Month",9895100.0
991.0,"INDO AUSTRALIA","Novel marine-derived lipases and processing methods for the production of omega-3 concentrates for functional foods, pharmaceuticals and nutraceuticals [BT/Indo-Aus/05/18/2010]","Dr. N Madhusudhana Rao
Centre For Cellular And Molecular Biology Hyderabad, Andhra Pradesh-500007","05/07/2011","3 Years 0 Month",6701040.0
992.0,"INDO AUSTRALIA","Engineering novel disease resistance in wheat and rice by silencing disease susceptibility genes [BT/Indo-Aus/04/36/2009]","Dr. k K  Kumar
Centre For Plant Molecular Biology Coimbatore, Tamilnadu-641101","09/07/2010","3 Years 0 Month",10063036.0
993.0,"INDO AUSTRALIA","Extraction and purification of sorghum seed protein for delayed delivery of bioactivities [BT/Indo-Aus/04/35/2009]","Dr. Sandeep  Kale
Institute of Chemical Technology (Formerley UDCT) Mumbai, Maharashtra-400019","15/06/2010","3 Years 0 Month",10136024.0
994.0,"INDO AUSTRALIA","Molecular recognition between alkane hydroxylase and rubredoxin in alkane-degrading bacteria [BT/Indo-Aus/04/02/2009]","Prof. Shyamalava  Mazumdar
Tata Institute Of Fundamental Research Mumbai, Maharashtra-400005","15/07/2010","3 Years 0 Month",5084024.0
995.0,"INDO AUSTRALIA","Solar Bio-fuel and Carbon Sequestration with Cyanobacteria: Role of Genetic Networks [BT/Indo-Aus/04/04/2009]","Dr. Pramod P Wangikar
INDIAN INSTITUTE OF TECHNOLOGY, BOMBAY Mumbai, Maharashtra-400076","16/06/2010","3 Years 0 Month",11834012.0
996.0,"INDO AUSTRALIA","Rational Development of an effective Vaccine for the prevention of Staphylococcal Mastitis in bovines using mouse mastitis as a model system [BT/Indo-Aus/04/06/2009]","Dr. Nagendra R Hegde
Ella Foundation Hyderabad, Andhra Pradesh-500078","16/07/2010","3 Years 0 Month",11062064.0
997.0,"INDO AUSTRALIA","Identification of diagnostic and prognostic biomarkers to improve the management of diabetic ulcers [BT/Indo-Aus/04/09/2009]","Dr. K  Satyamoorthy
Manipal University Manipal, Karnataka-576104","16/07/2010","3 Years 0 Month",9705048.0
998.0,"INDO-JAPAN","Insights into secondary metabolite production and their acumulation in withania somnifera using in vitro propagation system. [BT/IC/Japan(CE)/08/2010]","Dr. P K Pati
Guru Nanak Dev University Amritsar, Punjab-143001","01/11/2010","3 Years 0 Month",8858400.0
999.0,"INDO-JAPAN","Cross - genome survey of olfactory reception in five eukaryotic genomes with a special emphasis on receptors of odour response. [BT/IC/JAPAN(BI)/01/2010]","Dr. R  sowdhamini
National Centre For Biological Sciences Bangalore, Karnataka-560065","25/05/2009","4 Years 0 Month",4791080.0
1000.0,"INDO-JAPAN","Identification of efflux protein inhibitors to Gram negative organisms using bioinformatics tools and in vitro analysis and crystallographic studies of target membrane Protein- inhibitor complex [BT/BI/14/028/2007]","Dr. D  Velumurugan
University of Madras Chennai, Tamilnadu-600005","25/05/2009","4 Years 0 Month",5906680.0
1001.0,"INDO-JAPAN","Roles of Mortalin and CARF in Ovarian Cancer and Cancer Stem Cells. [BT/IC/Japan(CE)/09/2010]","Dr. Sharmila a Bapat
National Centre For Cell Science Pune, Maharashtra-411007","26/10/2010","3 Years 0 Month",8340400.0
1002.0,"INFRASTRUCTURE FACILITIES","Establishment of DBT UAS Biotech Hub at the University of Agricultural Sciences, Bangalore [BT/INF/UAS Bangalore/2011]","Dr. PH Ramajini  Gowda
University of Agricultural Sciences, Bangalore Bangalore, Karnataka-560065","03/11/2011","5 Years 0 Month",43450000.0
1003.0,"INFRASTRUCTURE FACILITIES","Setting up of a State-of-the-art 600 MHz FT-NMR with Cryoprobe facility at Bose Institute [BT/PR3106/INF/22/138/2011]","Dr. Gautam  Basu
Bose Institute Kolkata, West Bengal-700054","04/03/2013","5 Years 0 Month",88782000.0
1004.0,"INFRASTRUCTURE FACILITIES","DBT- Maharshi Dayanand University, Interdisciplinary Life Science Programme for Advance Research and Education [BT/PR4329/INF/22/144/2011]","Prof. Surendra Kumar Gakhar
Maharshi Dayanand University Rohtak, Haryana-124001","12/03/2012","5 Years 0 Month",28104400.0
1005.0,"INFRASTRUCTURE FACILITIES","DBT- Mahtam Gandhi University, Kottayam, Kerala, Interdisciplinary Life Science Programme for Advance Research and Education [BT/PR4800/INF/22/152/2012]","Dr. Prakash Kumar B
Mahatma Gandhi University, Kottayam Kottayam, Kerala-686560","22/03/2012","5 Years 0 Month",39507840.0
1006.0,"INFRASTRUCTURE FACILITIES","DBT-Osmania University Interdisciplinary Life Science Departments For Research And Education [BT/PR11801/INF/22/105/2009]","Prof. Surya Satyanarayana Singh
Osmania University Hyderabad, Andhra Pradesh-500007","22/09/2009","5 Years 0 Month",135070488.0
1007.0,"INFRASTRUCTURE FACILITIES","Support to establish DBT- Boost to University Interdisciplinary Life science Departments for Education and Research (BUILDER) programme [BT/PR4872/INF/22/150/2012]","Prof. Mohammed  Saleemuddin
Aligarh Muslim University Aligarh, Uttar Pradesh-202002","23/03/2012","5 Years 0 Month",97849600.0
1008.0,"INFRASTRUCTURE FACILITIES","DBT-Patna University-IPLS 
     Programme for Advance Research and Education [BT/PR4577/INF/22/149/2012]","Prof. Upendra Kishore Sinha
Patna University Patna, Bihar-800005","23/03/2012","5 Years 0 Month",44896830.0
1009.0,"INFRASTRUCTURE FACILITIES","DBT-ICRISAT Platform for Translational Research on Transgenic Crops (PTTC) [BT/PR9675/INF/22/77/2007]","Dr. Kiran K Sharma
INTERNATIONAL CROPS RESEARCH INSTT. FOR THE SEMI-ARID TROPIS Hyderabad, Andhra Pradesh-502324","24/03/2008","5 Years 0 Month",248790000.0
1010.0,"INFRASTRUCTURE FACILITIES","Primate Resource and research center and facility on small animals - an incubator for translational research at NII, New Delhi [BT/PR9109/INF/22/69/2007]","Dr. Subeer M Majumdar
National Institute of Immunology New Delhi, Delhi-110067","24/03/2008","5 Years 0 Month",228399684.0
1011.0,"INFRASTRUCTURE FACILITIES","Microbial Type Culture and Gene Bank(MTCC) an International Depository Authority (IDA): Expansion and continuation of its activities during the 11th Five Year Plan and Beyond [BT/IS/11/2001/2008]","Dr. Rakesh Kumar Jain
INSTITUTE OF MICROBIAL TECHNOLOGY Chandigarh, Chandigarh-160036","24/09/2008","5 Years 0 Month",70206800.0
1012.0,"INFRASTRUCTURE FACILITIES","DBT–BHU Interdisciplinary School of Life Science for Advanced Research and Education (DBT-BHU-ISLS) [BT/PR/101/BHU/08]","Prof. Rajiva  Raman
Banaras Hindu University Varanasi, Uttar Pradesh-221005","24/09/2009","5 Years 0 Month",238930000.0
1013.0,"INFRASTRUCTURE FACILITIES","Programme support for School of Biological Sciences and Biotechnology at IIAR [BT/PR11634/INF/22/104/2008]","Dr. Rajani  Nadgauda
INDIAN INSTITUTE OF ADVANCED RESEARCH Gandhinagar, Delhi-382007","24/09/2009","5 Years 0 Month",44880472.16
1014.0,"INFRASTRUCTURE FACILITIES","Procurement of Macromolecular crystallography beamline at ESRF, France [BT/PR10116/INF/22/85/2007]","Dr. Dinakar M Salunke
National Institute of Immunology New Delhi, Delhi-110067","24/12/2008","6 Years 0 Month",241926800.0
1015.0,"INFRASTRUCTURE FACILITIES","From Molecules to Systems: Exploring the biological space using chemical and synthetic biology [BT/PR5006/INF/22/153/2012]","Prof. Rajiv  Bhat
Jawaharlal Nehru University New Delhi, Delhi-110067","26/03/2012","5 Years 0 Month",173032000.0
1016.0,"INFRASTRUCTURE FACILITIES","DBT-Shivaji University, Kolhapur- Interdisciplinary Programme on Life Science for Advanced Research and Education [BT/PR4572/INF/22/147/2012]","Dr. Jyoti Prafull Jadhav
Shivaji University Kolhapur, Maharashtra-416004","27/03/2012","5 Years 0 Month",40104000.0
1017.0,"INFRASTRUCTURE FACILITIES","DBT-Punjabi University Patiala Interdisciplinary Life Science Programme for Advance Research and Education [BT/PR4548/INF/22/146/2012]","Prof. Raghubir Chand Gupta
Punjabi University Patiala Patiala, Punjab-147001","28/02/2012","5 Years 0 Month",36580000.0
1018.0,"INFRASTRUCTURE FACILITIES","Establishing State-of-the-Art Next-Generation Sequencing Facility [BT/PR3481/INF/22/140/2011]","Dr. Malali  Gowda
Centre For Cellular And Molecular Platforms Bangalore, Karnataka-560065","28/02/2013","5 Years 0 Month",77458800.89
1019.0,"INFRASTRUCTURE FACILITIES","DBT-Karnatak Interdisciplinary Life Science Programme for Advance Research and Education [BT/PR14555/INF/22/126/2010]","Dr. BB  Kaliwal
Karnatak University Sirsi, Karnataka-580003","28/09/2010","5 Years 0 Month",104161272.0
1020.0,"INFRASTRUCTURE FACILITIES","DBT-MSUB Interdisciplinary Life Science Programme for Advance Research and Education [BT/PR14551/INF/22/122/2010]","Prof. Sarita Sharadchandra Gupta
M. S. University of Baroda Vadodara, Gujarat-390001","28/09/2010","5 Years 0 Month",127901096.0
1021.0,"INFRASTRUCTURE FACILITIES","DBT- MKU INTERDISCIPLINARY PROGRAMME OF LIFE SCIENCES FOR ADVANCED RESEARCH AND EDUCATION [BT/PR14553/INF/22/124/2010]","Prof. Paramasamy  Gunasekaran
Madurai Kamraj University Madurai, Tamilnadu-625021","28/09/2010","5 Years 0 Month",117635064.0
1022.0,"INFRASTRUCTURE FACILITIES","DBT-PU INTERDISCIPLINARY LIFE SCIENCE PROGRAMME FOR ADVANCE RESEARCH AND EDUCATION [BT/PR14554/INF/22/125/2010]","Prof. P P  Mathur
Pondicherry University Pondicherry, Pondicherry-605014","28/09/2010","5 Years 0 Month",97300320.0
1023.0,"INFRASTRUCTURE FACILITIES","DBT-CU Interdisciplinary Life Science Programme for Advance Research and Education [BT/PR14552/INF/22/123/2010]","Dr. Maitrayee  DasGupta
University of Calcutta Kolkata, West Bengal-700073","28/09/2010","5 Years 0 Month",134098016.0
1024.0,"INFRASTRUCTURE FACILITIES","DBT-University of Rajasthan Interdisciplinary Life Science Program for Advanced Research and Education [BT/PR14550/INF/22/121/2010]","Prof. SL  Kothari
University of Rajasthan Jaipur, Rajasthan-302004","28/09/2010","5 Years 0 Month",98953920.0
1025.0,"INFRASTRUCTURE FACILITIES","DBT-IISc Partnership Program for Advanced Research in Biological Sciences & Bioengineering at Division of Biological Sciences, Indian Institute of Science, Bengaluru [DBT/BF/PRIns/2011-12/IISc]","Dr. Desirazu Narasimha Rao
INDIAN INSTITUTE OF SCIENCE Bangalore, Karnataka-560012","28/09/2012","5 Years 0 Month",693971000.0
1026.0,"INFRASTRUCTURE FACILITIES","A Small Monlecule Inhibitor Discovery Unit for Tuberculosis [BT/01/ICGEB/TB/10/01]","Dr. Kanury V S Rao
International Centre for Genetic Engineering &  Biotechnology New Delhi, Delhi-110067","29/03/2011","5 Years 0 Month",92536000.0
1027.0,"INFRASTRUCTURE FACILITIES","Maintenance of 'Repository for Filarial Parasites and Reagents' [BT/PR4988/INF/22/155/2012]","Dr. MVR  Reddy
Mahatama Gandhi Instt. of Medical Sciences Wardha, Maharashtra-442102","29/05/2012","5 Years 0 Month",10000000.0
1028.0,"INTERNATIONAL COLLABORATION-I","Structure-Based Discovery of Antivirals for the treatment of Chikungunya Virus infections (ANTI-CHIK) [BT/IN/New Indigo/14/DV/2010]","Dr. D  Velmurgan
University of Madras Chennai, Tamilnadu-600005","03/02/2011","3 Years 0 Month",6591020.0
1029.0,"INTERNATIONAL COLLABORATION-I","""PET-MRI Automatic Tumour Detection and Recognition (ATR)"" [BT/IN/Canada/19/SS/2009]","Dr. Subashini  Jonn
Christian Medical College Vellore Association Vellore, Tamilnadu-632004","03/06/2010","3 Years 0 Month",11583032.0
1030.0,"INTERNATIONAL COLLABORATION-I","Dissecting the molecular function of KIRBA in memory formation [BT/IN/German/01/RSK/2010]","Dr. Rayala suresh kumar
INDIAN INSTITUTE OF TECHNOLOGY, MADRAS Chennai, Tamilnadu-600036","03/08/2010","3 Years 0 Month",8328008.0
1031.0,"INTERNATIONAL COLLABORATION-I","Structural and functiona characterization of helicobacter pylori pre-initiation complex proteins [BT/IN/German/09/SG/2010]","Dr. Samudrala  Gourinath
Jawaharlal Nehru University New Delhi, Delhi-110067","03/08/2010","3 Years 0 Month",6713008.0
1032.0,"INTERNATIONAL COLLABORATION-I","Target specific small molecules to control infections due to Trypanosomatids [BT/IN/New Indigo/12/NR/2010]","Dr. Nilanjan  Roy
National Institute of Pharmaceutical Education And Research (NIPER) - Jehanbad Jehanbad, Punjab-844101","07/12/2010","3 Years 0 Month",3338000.0
1033.0,"INTERNATIONAL COLLABORATION-I","Fine mapping of spot blotch disease resistance gene for map based cloning [BT/IN/German/10/UK/2010]","Dr. Uttam  Kumar
The Energy And Resources Institute, New Delhi New Delhi, Delhi-110003","10/08/2010","3 Years 0 Month",5982024.0
1034.0,"INTERNATIONAL COLLABORATION-I","The neurobiology of hereditary retinal diseases:genes and molecular dysfunctions underlying disorders of the neuroretina [BT/IN/German/13/VK/2010]","Dr. Vanita  Kumar
Guru Nanak Dev University Amritsar, Punjab-143001","10/09/2010","3 Years 0 Month",10740024.0
1035.0,"INTERNATIONAL COLLABORATION-I","Production of scFv for human s-Fit-1 and sTie-2: TRAIL fusion protein with selective binding properties and apoptotic potential using immunoliposomes. [BT/IN/German/06/BPS/2010]","Prof. Bharathi P Salimath
University of Mysore Mysore, Karnataka-570005","10/09/2010","3 Years 0 Month",6562032.0
1036.0,"INTERNATIONAL COLLABORATION-I","Nano LINEN Nanotoxicology link between India and European research [BT/IN/New Indigo/17/AD/2010]","Dr. Alok  Dhawan
Indian Institute of Toxicology Research Lucknow, Uttar Pradesh-226001","10/11/2010","3 Years 0 Month",4408008.0
1037.0,"INTERNATIONAL COLLABORATION-I","Structure-function analysis of laminin-binding adhesin (Lmb) of streptococcus agalactiae and its mutants [BT/IN/FRG/07/PK/2010]","Dr. P  Karthe
University of Madras Chennai, Tamilnadu-600005","11/08/2010","3 Years 0 Month",3544016.0
1038.0,"INTERNATIONAL COLLABORATION-I","Chitosan/Copper-Nanoparticles and Biopesticides for knowledge-based plant protection. [BT/IN/German/19/JK/2010]","Prof. Jatinder  Kumar
G.B. Pant University of Agric. & Tech. Pantnagar Pant Nagar, Uttarakhand-263128","12/05/2011","4 Years 0 Month",17616112.0
1039.0,"INTERNATIONAL COLLABORATION-I","Alzbioindigo, Accelerating the development of new molecular Bio Markers for Alzheimer's disease [BT/IN/New Indigo/09/RB/2010]","Dr. Rupam  Borgohain
Nizam's Institute of Medical Sciences Hyderabad, Andhra Pradesh-500082","14/12/2010","3 Years 0 Month",2682012.0
1040.0,"INTERNATIONAL COLLABORATION-I","The potential of fungal endophytes as biocontrol organisms [BT/IN/German/11/TSS/2010]","Dr. T S Suryanarayanan
Ramakrishna Mission Vivekananda College Chennai, Tamilnadu-600004","17/02/2011","3 Years 0 Month",3659024.0
1041.0,"INTERNATIONAL COLLABORATION-I","Data integration to identify biomarkers to diagnose and monitor Type I diabetes and other inflammatory diseases [BT/IN/Finnish/23/SG/2009]","Dr. Sanjeev  Galande
Indian Institute of Science Education and Research, West Bengal Ranaghat, Maharashtra-741252","17/09/2010","3 Years 0 Month",20211052.0
1042.0,"INTERNATIONAL COLLABORATION-I","Elucidating the pathogenesis of staphylococcal diseases by studing virulence factors of Indian Community Associated Methicillin Resistant Stphylococuus aureus [BT/IN/New Indigo/16/GA/2010]","Dr. Gayathri  Arakere
Society For Innovation And Development,Indian Institute of Science, Banglore Bangalore, Karnataka-560012","18/05/2011","3 Years 0 Month",3300032.0
1043.0,"INTERNATIONAL COLLABORATION-I","IMPACT OF AGENTS WITH POTENTIAL USE IN FUNCTIONAL FOODS ON BIOMARKERS FOR INDUCTION OF AGE RELATED DISEASES [BT/IN/EU/17/SN/2009]","Dr. S  Nagini
Annamalai University Cuddalore, Tamilnadu-608002","19/03/2010","4 Years 0 Month",41120080.0
1044.0,"INTERNATIONAL COLLABORATION-I","Standardization of response assessment in Chronic Myeloid Leukemia (CML) [BT/IN/New Indigo/07/VR/2010]","Dr. Vinod  Raina
All India Institute Of Medical Sciences New Delhi, Delhi-110029","20/05/2011","3 Years 0 Month",21226104.0
1045.0,"INTERNATIONAL COLLABORATION-I","Innovative concept for infectious disease diagnostics [BT/IN/Finland/03/SS/2011]","Dr. S  Swaminathan
International Centre for Genetic Engineering &  Biotechnology New Delhi, Delhi-110067","20/07/2011","2 Years 0 Month",7515032.0
1046.0,"INTERNATIONAL COLLABORATION-I","Gender equity-focused, male-centered family planning for rural India. [BT/IN/US/01/BD/2010]","Dr. Balaiah  Donta
National Institute For Research In Reproductive Health Mumbai, Maharashtra-400012","20/08/2010","4 Years 0 Month",12623280.0
1047.0,"INTERNATIONAL COLLABORATION-I","Comparative evaluation of human brain in vitamin B-12 deficiency using EPI based and STEAM based DTI Techniques [BT/IN/German/04/RKG/2010]","Dr. Rakesh K Gupta
Sanjay Gandhi Post Graduate Institute of Medical Sciences Lucknow, Uttar Pradesh-226014","20/08/2010","3 Years 0 Month",3288024.0
1048.0,"INTERNATIONAL COLLABORATION-I","An epigenetic study on the role of parasite Wolbachia and human TLR polymorphism in human fiariasis [BT/IN/German/05/BR/2010]","Dr. B  Ravindran
INSTITUTE OF LIFE SCIENCES Bhubaneswar, Orissa-751023","20/09/2010","3 Years 0 Month",7066040.0
1049.0,"INTERNATIONAL COLLABORATION-I","Surface Engineered Coatings on Mechanical Heart Valves: Diagnostics of Thrombosis [BT/IN/New Indigo/11/AS/2010]","Dr. Aryasomayajula  Subrahmanyam
INDIAN INSTITUTE OF TECHNOLOGY, MADRAS Chennai, Tamilnadu-600036","21/01/2011","3 Years 0 Month",2799012.0
1050.0,"INTERNATIONAL COLLABORATION-I","Studies on the early and late signaling events in the pathogenesis of tuberculosis [BT/IN/German/02/SKV/2010]","Dr. Sunil Kumar Verma
Centre For Cellular And Molecular Biology Hyderabad, Andhra Pradesh-500007","22/11/2010","3 Years 0 Month",9061044.0
1051.0,"INTERNATIONAL COLLABORATION-I","Understanding common pathogenic mechanisms in Parkinson's disease using genetic and neurotoxin induced mouse models. [BT/IN/German/14/VR/2010]","Dr. Vijaylakshmi  Ravindranath
INDIAN INSTITUTE OF SCIENCE Bangalore, Karnataka-560012","23/08/2010","3 Years 0 Month",5063024.0
1052.0,"INTERNATIONAL COLLABORATION-I","Array platform technology for multiplexed diagnostics [BT/IN/Finland/04/NK/2011]","Dr. Navin  Khanna
International Centre for Genetic Engineering &  Biotechnology New Delhi, Delhi-110067","24/05/2011","2 Years 0 Month",5564000.0
1053.0,"INTERNATIONAL COLLABORATION-I","Structure based design of Dengue virus protease inhibitors [BT/IN/Germon/15/DV/2010]","Dr. D  Velumurugan
University of Madras Chennai, Tamilnadu-600005","28/10/2010","3 Years 0 Month",7485072.0
1054.0,"INTERNATIONAL COLLABORATION-II ","Establishment of Technology Advancement Unit of Indo Swiss Collaboration in Biotechnology programme [BT/IC-2/SWISS/TAU/2009]","Dr. Dinakur M  Salunke
Regional Centre For Biotechnology,Gurgoan Gurgaon, Haryana-122016","23/03/2011","3 Years 0 Month",8624000.0
1055.0,"MEDICAL BIOTECHNOLOGY","CHARACTERIZATION OF UROPATHOGENIC E. COLI STRAINS ASSOCIATED WITH SPECIFIC CLINICAL SYNDROME AND FECAL E. COLI POPULATION OF THE SAME WOMEN: ARE THERE DISTINCT UROPATHOTYPES? -II [BT/PR13637/MED/29/172/2010]","Dr. Jyotsna  Aggarwal
C.S.M. Medical University, Lucknow Lucknow, Uttar Pradesh-226003","13/09/2010","3 Years 0 Month",5047000.0
1056.0,"MEDICAL BIOTECHNOLOGY - DEVELOPMENTAL AND DISEASE","Evaluating the role of Sirtuins and epigenetic changes during cellular senescence in context of p53 status [BT/PR4062/MED/97/48/2011]","Dr. Gayatri  Ramakrishna
Centre For DNA Fingerprinting and Diagnostics Hyderabad, Andhra Pradesh-500001","06/03/2012","3 Years 0 Month",7032800.0
1057.0,"MEDICAL BIOTECHNOLOGY - DEVELOPMENTAL AND DISEASE","Effect of perinatal exposure to Bisphenol A on the expression and
regulation of synaptic proteins in the brain of mice of different ages [BT/PR3996/MED/97/57/2011]","Dr. MK  Thakur
Banaras Hindu University Varanasi, Uttar Pradesh-221005","13/03/2012","3 Years 0 Month",5163000.0
1058.0,"MEDICAL BIOTECHNOLOGY - DEVELOPMENTAL AND DISEASE","Neuroimmunological and cognitive implications of perinatal
bacterial (lipopolysaccharide) infections during ageing [BT/PR3908/MED/97/8/2011]","Dr. Ishan  Patro
Jiwaji University Gwalior, Madhya Pradesh-474011","13/03/2012","3 Years 0 Month",5794400.0
1059.0,"MEDICAL BIOTECHNOLOGY - DEVELOPMENTAL AND DISEASE","Epigenetic regulation of Aging [BT/PR3997/MED/97/33/2011]","Dr. Raghuvir Singh Tomar
Indian Institute of Science Education and Research (IISER), Bhopal Bhopal, Madhya Pradesh-462023","15/03/2012","3 Years 0 Month",3820000.0
1060.0,"MEDICAL BIOTECHNOLOGY - DEVELOPMENTAL AND DISEASE","Bilirubin Neurotoxicity: Role of P-glycoprotein Gene Polymorphism and
Free Bilirubin Level [BT/PR4033/MED/97/41/2011]","Dr. Deepak  Chawla
Government Medical College and  Hospital, Chandigarh Chandigarh, Chandigarh-160030","21/03/2012","3 Years 0 Month",4487584.0
1061.0,"MEDICAL BIOTECHNOLOGY - DEVELOPMENTAL AND DISEASE","Identification of biomarkers for risk prediction and disease progression in Retinopathy of prematurity (ROP): a potentially blinding neonatal disorder [BT/PR3992/MED/97/31/2011]","Dr. Inderjeet  Kaur
L.V. Prasad Eye Institute, Bhubaneswar Bhubaneswar, Andhra Pradesh-751024","22/03/2012","3 Years 0 Month",10945400.0
1062.0,"MEDICAL BIOTECHNOLOGY - DEVELOPMENTAL AND DISEASE","Identification of intrauterine factors of relevance in Intrauterine Growth
Restriction (IUGR): A functional genomics approach [BT/PR3926/MED/97/13/2011]","Dr. Dhanjit Kumar Das
National Institute For Research In Reproduction Health Mumbai, Maharashtra-400012","22/03/2012","3 Years 0 Month",6000000.0
1063.0,"MEDICAL BIOTECHNOLOGY - DEVELOPMENTAL AND DISEASE","Genetic determinants of birth weight and growth trajectory and influence of parental genotype on these anthropometric indicators [BT/PR3874/MED/97/1/2011]","Dr. Nikhil  Tandon
All India Institute Of Medical Sciences New Delhi, Delhi-110029","23/03/2012","3 Years 0 Month",16907068.0
1064.0,"MEDICAL BIOTECHNOLOGY - DEVELOPMENTAL AND DISEASE","Study of genetic profiles of
mucopolysaccharidosis (MPS) patients
in South India [BT/PR4224/MED/97/60/2011]","Dr. Sudha  Srinivasan
Centre For Human Genetics Bangalore, Karnataka-560066","23/03/2012","3 Years 0 Month",5612444.0
1065.0,"MEDICAL BIOTECHNOLOGY - DEVELOPMENTAL AND DISEASE","PDE-IV as target for Parkinson’s disease: Synthesis of
congeners of Irsogladine, and their evaluation in
cellular and animal models of the disease [BT/PR3895/MED/97/6/2011]","Dr. KP  Mohanakumar
INDIAN INSTITUTE OF CHEMICAL BIOLOGY Kolkata, West Bengal-700032","23/03/2012","3 Years 0 Month",6636426.0
1066.0,"MEDICAL BIOTECHNOLOGY - DEVELOPMENTAL AND DISEASE","Molecular basis of maternal vitamin B12 restriction induced  changes in the 
C57BL/6 mouse offspring: Role of epigenetics. [BT/PR3965/MED/97/25/2011]","Dr. M  Raghunath
National Institute of Nutrition Hyderabad, Andhra Pradesh-500007","23/03/2012","3 Years 0 Month",8061900.0
1067.0,"MEDICAL BIOTECHNOLOGY - DEVELOPMENTAL AND DISEASE","Why acute respiratory infections during infancy lead to chronic airway diseases during childhood: differential role of smaller airways and immune imbalance [BT/PR3881/MED/97/2/2011]","Dr. Sushil Kumar  Kabra
All India Institute Of Medical Sciences New Delhi, Delhi-110029","27/03/2012","3 Years 0 Month",12438192.0
1068.0,"MEDICAL BIOTECHNOLOGY - DEVELOPMENTAL AND DISEASE","Experimental and clinical basis of novel treatment strategy using mitochondrial modulators in neonatal anoxic injury [BT/PR3950/MED/97/19/2011]","Dr. Sairam  Krishnamurthy
Banaras Hindu University Varanasi, Uttar Pradesh-221005","28/02/2012","3 Years 0 Month",7199540.0
1069.0,"MEDICAL BIOTECHNOLOGY - DEVELOPMENTAL AND DISEASE","Clinical application of array-based Comparative Genomic Hybridization (array CGH) in the genetic evaluation of stillbirths [BT/PR3910/MED/97/9/2011]","Prof. Madhulika  Kabra
All India Institute Of Medical Sciences New Delhi, Delhi-110029","28/03/2012","3 Years 0 Month",11211922.0
1070.0,"MEDICAL BIOTECHNOLOGY - DEVELOPMENTAL AND DISEASE","Role of gain in fat mass in early infancy on programming of adiposity and biochemical markers associated with cardiometabolic risk [BT/PR3884/MED/97/3/2011]","Dr. Vandana  Jain
All India Institute Of Medical Sciences New Delhi, Delhi-110029","28/03/2012","3 Years 0 Month",6987324.0
1071.0,"MEDICAL BIOTECHNOLOGY - HUMAN GENETICS AND GENOME","Genome Wide Association Study of Chronic Pancreatitis [BT/PR15101/MED/12/499/2011]","Dr. Pramod  Garg
All India Institute Of Medical Sciences New Delhi, Delhi-110029","01/08/2011","3 Years 0 Month",16326956.0
