1384.0,"MEDICAL BIOTECHNOLOGY - NON-INFECTIOUS DISEASES","Understanding Neuron-Glia Crosstalk in HIV Neuropathogenesis (National Initiative on Glial Cell
Research in Health and Disease) [BT/PR5350/MED/30/811/2012]","Dr. Pankaj  Seth
National Brain Research Centre Gurgaon, Haryana-122050","22/03/2012","3 Years 0 Month",3514000.0
1385.0,"MEDICAL BIOTECHNOLOGY - NON-INFECTIOUS DISEASES","Neuro-Imaging Endophenotypes in Obsessive Compulsive Disorder [BT/PR13334/MED/30/259/2009]","Prof. Janardhan YC Reddy
National Institute of Mental Health & Neuro Sciences Bangalore, Karnataka-560029","22/04/2010","3 Years 0 Month",3045048.0
1386.0,"MEDICAL BIOTECHNOLOGY - NON-INFECTIOUS DISEASES","Evaluating the  Calcineurin–NFAT pathway and its regulators superoxide dismutase (SOD) and RCAN1 (regulator of calcineurin) in  Down Syndrome [BT/PR14008/MED/30/312/2010]","Dr. Gayatri  Ramakrishna
Centre For DNA Fingerprinting and Diagnostics Hyderabad, Andhra Pradesh-500001","22/09/2010","3 Years 0 Month",4495020.0
1387.0,"MEDICAL BIOTECHNOLOGY - NON-INFECTIOUS DISEASES","Role of Epigenetics in fear memory consolidation and extinction [BT/PR14365/MED/30/522/2010]","Dr. anand  Prakash
Babasaheb Bhimrao Ambedkar University Lucknow, Uttar Pradesh-226025","22/09/2011","3 Years 0 Month",6307012.0
1388.0,"MEDICAL BIOTECHNOLOGY - NON-INFECTIOUS DISEASES","Elucidating the role of x Synuclein Isoforms Employing Novel Cellular Models of Parkinsons Disease. [BT/PR/14497/MED/30/551/2010]","Dr. Shasi Vardhan Kalivendi
INDIAN INSTITUTE OF CHEMICAL TECHNOLOGY Hyderabad, Andhra Pradesh-500007","22/09/2011","3 Years 0 Month",4611040.0
1389.0,"MEDICAL BIOTECHNOLOGY - NON-INFECTIOUS DISEASES","Efficacy of Behavioral Strategies of Enriched Environment and Physical Exercise with Dietary Supplements on Establishing a Sustained Functional Recovery in Ventral Subicular Lesioned Rats [BT/PR14228/MED/30/413/2010]","Dr. Bindu M Kutty
National Institute of Mental Health & Neuro Science Bangalore, Karnataka-560029","22/09/2011","3 Years 0 Month",7136032.0
1390.0,"MEDICAL BIOTECHNOLOGY - NON-INFECTIOUS DISEASES","Evalution of the potential of two monoclonal antibodies for treatment of androgen-independent prostatic carcinomas [BT/PR13235/MED/30/250/2009]","Dr. Jagdish C Gupta
Talwar Research Foundation New Delhi, Delhi-110068","23/03/2010","3 Years 0 Month",6231008.0
1391.0,"MEDICAL BIOTECHNOLOGY - NON-INFECTIOUS DISEASES","Regulation of SOS response in mycobacterium by sigma factors: its role in drug resistance and virulence [BT/PR12742/MED/30/215/2009]","Dr. Krishna Murari Sinha
The Institute of Molecular Medicine Kolkata, Delhi-70009","23/03/2010","3 Years 0 Month",4162020.0
1392.0,"MEDICAL BIOTECHNOLOGY - NON-INFECTIOUS DISEASES","Measurement of Intracellular Methotrexate-Polyglutamate levels in Rheumatoid Arthritis and its Relationship to Efficacy and Adverse effects [BT/PR4608/MED/30/800/2012]","Dr. Varun  Dhir
Post Graduate Institute of Medical Education and Research Chandigarh, Chandigarh-160012","23/03/2012","3 Years 0 Month",4007036.0
1393.0,"MEDICAL BIOTECHNOLOGY - NON-INFECTIOUS DISEASES","Evaluate the mechanism of resveratrol mediated apoptosis in cigarette smoke induced brest cancer [BT/PR12701/MED/30/205/2009]","Dr. Chanakaya Nath Kundu
Kalinga Institute Of Industrial Technology Bhubaneswar, Orissa-751024","23/04/2010","3 Years 0 Month",3452024.0
1394.0,"MEDICAL BIOTECHNOLOGY - NON-INFECTIOUS DISEASES","ROLE OF SELENIUM AND SELENOPROTEINS IN PATHOLOGY OF ALZHEIMER’S DISEASE [BT/PR3869/MED/30/667/2011]","Dr. P  Rani
PSG College of Technology Coimbatore, Tamilnadu-641004","23/04/2012","3 Years 0 Month",3107000.0
1395.0,"MEDICAL BIOTECHNOLOGY - NON-INFECTIOUS DISEASES","The control of sequential movements by basal ganglia networks [BT/PR13195/MED/30/244/2009]","Dr. Aditya  Murthy
INDIAN INSTITUTE OF SCIENCE Bangalore, Karnataka-560012","23/09/2010","3 Years 0 Month",7964024.0
1396.0,"MEDICAL BIOTECHNOLOGY - NON-INFECTIOUS DISEASES","Development of low cost prognostic kit s for brain stroke patients. [BT/PR14368/MED/30/525/2010]","Dr. Rajpal S Kashyap
Central India Institute Of Medical Sciences Nagpur, Maharashtra-440010","23/09/2011","3 Years 0 Month",1853012.0
1397.0,"MEDICAL BIOTECHNOLOGY - NON-INFECTIOUS DISEASES","Molecular Mechanisms of Hypoxia Resistance in Glioblastoma : Role of MicroRNAs [BT/PR/4295/MED/30/463/2010]","Dr. Ritu  Kulshreshtha
INDIAN INSTITUTE OF TECHNOLOGY, DELHI New Delhi, Delhi-110016","23/09/2011","3 Years 0 Month",6597016.0
1398.0,"MEDICAL BIOTECHNOLOGY - NON-INFECTIOUS DISEASES","Exploring Some Protein Targets in Glioblastoma in Search of Potential Antitumour Agents [BT/PR14373/MED/30/530/2010]","Dr. Urmila Jaideep Joshi
K.M. Kundnani College of Pharmacy Mumbai, Maharashtra-40005","23/09/2011","3 Years 0 Month",2695020.0
1399.0,"MEDICAL BIOTECHNOLOGY - NON-INFECTIOUS DISEASES","“Endometrial Receptivity to Implantation in Infertile Women with Leiomyoma Uteri: Role of PI3K/Akt/mTOR signal transduction Pathway” [BT/PR5242/MED/30/803/2012]","Prof. Madhu Mati Goel
Chhatrapati Shahuji Maharaj Medical University, Lucknow (Formerly Known As King George's Medical University) Lucknow, Uttar Pradesh-226003","24/01/2013","3 Years 0 Month",4847000.0
1400.0,"MEDICAL BIOTECHNOLOGY - NON-INFECTIOUS DISEASES","Evaluation of the role of endogenous precursor cells in     enhancing  functional recovery following cold induced brain injury [BT/PR11369/MED/30/138/2008]","Dr. Ranjith K Moorthy
Christian Medical College Vellore Association Vellore, Tamilnadu-632004","24/05/2010","3 Years 0 Month",2096016.0
1401.0,"MEDICAL BIOTECHNOLOGY - NON-INFECTIOUS DISEASES","Hypoxia and North signaling in Glioblastoma : Implications for an adverse phenotype. [BT/PR/13645/MED/30/290/2010]","Dr. Kunzang  Chosdol
All India Institute Of Medical Sciences New Delhi, Delhi-110029","25/03/2011","3 Years 0 Month",4931372.0
1402.0,"MEDICAL BIOTECHNOLOGY - NON-INFECTIOUS DISEASES","Iron overload in alcoholic liver disease: why does it occur? [BT/PR12738/MED/30/214/2009]","Dr. MOLLY  JACOB
Christian Medical College Vellore Association Vellore, Tamilnadu-632004","25/03/2011","3 Years 0 Month",3621008.0
1403.0,"MEDICAL BIOTECHNOLOGY - NON-INFECTIOUS DISEASES","Glioma serum biomarker discovery through proteomic approaches [BT/PR14076/MED/30/369/2010]","Dr. Kumaravel  Somasundaram
INDIAN INSTITUTE OF SCIENCE Bangalore, Karnataka-560012","25/03/2011","3 Years 0 Month",8310012.0
1404.0,"MEDICAL BIOTECHNOLOGY - NON-INFECTIOUS DISEASES","Sequence dependent molecular action of ZD6474  with paclitaxel and radiation in progression and treatment of breast cancer [BT/PR13996/MED/30/309/2010]","Prof. Mahitosh  Mandal
INDIAN INSTITUTE OF TECHNOLOGY, KHARAGPUR Kharagpur, West Bengal-721302","25/03/2011","3 Years 0 Month",3150008.0
1405.0,"MEDICAL BIOTECHNOLOGY - NON-INFECTIOUS DISEASES","A chemical biology approach to discover Allosteric modulators of sirtuins and to understand their mode of action [BT/PR14137/MED/30/374/2010]","Dr. Prabhat  Arya
Institute of Life Sciences, Hyderabad Hyderabad, Andhra Pradesh-500046","25/03/2011","2 Years 0 Month",2960032.0
1406.0,"MEDICAL BIOTECHNOLOGY - NON-INFECTIOUS DISEASES","A yeast based screen for discovery of novel sirtuin inhibitors as anti-cancer agents [BT/PR13997/MED/30/310/2010]","Dr. Devyani  Haldar
Institute of Life Sciences, Hyderabad Hyderabad, Andhra Pradesh-500046","25/03/2011","2 Years 0 Month",3252016.0
1407.0,"MEDICAL BIOTECHNOLOGY - NON-INFECTIOUS DISEASES","Identification of new autoantigens in Rheumatoid Arthritis using an unbiased clinical proteomics approach [BT/PR4671/MED/30/815/2012]","Dr. Padmanabha  Shenoy
Amrita Institute Of Medical Sciences And Research Center Cochin, Kerala-682026","25/04/2012","3 Years 0 Month",4997008.0
1408.0,"MEDICAL BIOTECHNOLOGY - NON-INFECTIOUS DISEASES","Revised project: Molecular Mechanisms of Neuroprotection Mediated through Adenosine A2A Receptor [BT/PR4507/MED/30/833/2012]","Dr. Pratibha Mehta Luthra
University of Delhi, North Campus Delhi, Delhi-110007","25/05/2012","3 Years 11 Month",4831001.6
1409.0,"MEDICAL BIOTECHNOLOGY - NON-INFECTIOUS DISEASES","Development and Evaluation of In-house line probe assay for rapid detection of MDR and XDR Tuberculosis [BT/PR15200/MED/29/276/2011]","Dr. Urvashi B Singh
All India Institute Of Medical Sciences New Delhi, Delhi-110029","25/07/2011","3 Years 0 Month",3121020.0
1410.0,"MEDICAL BIOTECHNOLOGY - NON-INFECTIOUS DISEASES","Identification of Potential strategies for the protection against Alzheimer's disease [BT/PR10722/MED/30/106/2008]","Dr. Jamuna R Subramaniam
INDIAN INSTITUTE OF TECHNOLOGY, KANPUR kanpur, Uttar Pradesh-208016","25/08/2009","3 Years 9 Month",2958000.0
1411.0,"MEDICAL BIOTECHNOLOGY - NON-INFECTIOUS DISEASES","Neuroimmunogenetic & Functional MRI Correlates of Smooth Pursuit Eye Movement Deficits: An Imaging Genomics Study of   a Novel Composite Biomarker for Schizophrenia [BT/PR14200/MED/30/391/2010]","Dr. Ganesan  Venkatasubramanian
National Institute of Mental Health & Neuro Science Bangalore, Karnataka-560029","25/08/2011","3 Years 0 Month",7689020.0
1412.0,"MEDICAL BIOTECHNOLOGY - NON-INFECTIOUS DISEASES","Detection of underlying key molecular switches for acquirement of chemo resistance in patients with relapsed epithelial ovarian carcinoma [BT/PR4141/MED/30/680/2011]","Dr. Pritha  Ray
Advanced Centre For Treatment Research & Education In Cancer Mumbai, Maharashtra-410210","26/02/2013","1 Years 6 Month",3888200.0
1413.0,"MEDICAL BIOTECHNOLOGY - NON-INFECTIOUS DISEASES","IMPACT OF STRESS ON EXPERIMENTAL PARKINSON’S DISEASE: CAUSATIVE OR PROGRESSIVE AGENTS OF PD? [BT/PR4958/MED/30/748/2012]","Dr. Mani  vasagam
Annamalai University Cuddalore, Tamilnadu-608002","26/02/2013","3 Years 0 Month",4557000.0
1414.0,"MEDICAL BIOTECHNOLOGY - NON-INFECTIOUS DISEASES","Role of small molecule inhibitor as targeted therapy in pancreatic and prostate cancers using in vitro and in vivo models [BT/PR12730/MED/30/212/2009]","Dr. Surajit  Sinha
INDIAN ASSOCIATION FOR THE CULTIVATION OF SCIENCE Kolkata, West Bengal-700032","26/03/2010","3 Years 0 Month",3956016.0
1415.0,"MEDICAL BIOTECHNOLOGY - NON-INFECTIOUS DISEASES","Nanoparticle based Drug delivery system of some antiepileptic drugs for Brain Drug Delivery through nasal route [BT/PR1891/MED/30/626/2011]","Dr. Shweta  Dang
Jaypee Institute of Information Technology University Solan, Uttar Pradesh-171009","26/09/2011","2 Years 0 Month",2517508.0
1416.0,"MEDICAL BIOTECHNOLOGY - NON-INFECTIOUS DISEASES","Isolation and Characterisation of Toxic Factor(s) present in the CSF of [BT/PR14054/MED/30/349/2010]","Dr. Trichur Ramaswamy Raju
National Institute of Mental Health & Neuro Sciences Bangalore, Karnataka-560029","26/10/2010","3 Years 0 Month",7577020.0
1417.0,"MEDICAL BIOTECHNOLOGY - NON-INFECTIOUS DISEASES","Engineering of Photoactivated Adenylate Cyclase (PAC) for the Development of Optogenetic Tools for Neuroscience Applications [BT/PR4992/MED/30/754/2012]","Dr. Suneel  Kateriya
Delhi University, South Campus New Delhi, Delhi-110021","27/02/2013","3 Years 0 Month",4541916.0
1418.0,"MEDICAL BIOTECHNOLOGY - NON-INFECTIOUS DISEASES","Identification of immunodominant epitopes of HLA B*2705 binding Salmonella typhimurium outer membrane proteins (OMP) A and D in patients with Reactive arthritis and Undifferentiated spondyloarthropathy. [BT/PR5170/MED/30/802/2012]","Prof. Ramnath  Misra
Sanjay Gandhi Post Graduate Institute of Medical Sciences Lucknow, Uttar Pradesh-226014","27/02/2013","3 Years 0 Month",4620000.0
1419.0,"MEDICAL BIOTECHNOLOGY - NON-INFECTIOUS DISEASES","Prevalence And Clinical Impact Of Human Papilloma Virus In Patients 
  With Head And Neck Squamous Cell Cancer Treated With Radiotherapy or
  Chemoradiotherapy. [BT/PR15004/MED/30/585/2010]","Dr. Vedang  Murthy
Advanced Centre For Treatment Research & Education In Cancer Mumbai, Maharashtra-410210","27/03/2012","3 Years 0 Month",5977000.0
1420.0,"MEDICAL BIOTECHNOLOGY - NON-INFECTIOUS DISEASES","Effects of an alkaloid on amyloid beta-induced changes in astrocytes: implications for Alzheimer’s disease (National Initiative on Glial Cell Research in Health and Disease) [BT/PR3998/MED/30/668/2011]","Dr. Shiv Kumar Sharma
National Brain Research Centre Gurgaon, Haryana-122050","27/03/2012","3 Years 0 Month",3164000.0
1421.0,"MEDICAL BIOTECHNOLOGY - NON-INFECTIOUS DISEASES","Parental consanguinity among schizophrenia patients living in a rural community of south India A clinical and genetic investigation [BT/PR14342/MED/30/499/2010]","Dr. Jagadisha  Thirthalli
National Institute of Mental Health & Neuro Sciences Bangalore, Karnataka-560029","27/03/2012","2 Years 0 Month",3524000.01
1422.0,"MEDICAL BIOTECHNOLOGY - NON-INFECTIOUS DISEASES","Cellular and molecular basis of endogenous depression
induced cognitive deficits [BT/PR14296/MED/30/464/2010]","Dr. BS Shankaranaryana Rao
National Institute of Mental Health & Neuro Sciences Bangalore, Karnataka-560029","27/03/2012","3 Years 0 Month",8185000.0
1423.0,"MEDICAL BIOTECHNOLOGY - NON-INFECTIOUS DISEASES","Effect of different extracts of Withania somnifera in the treatment of rheumatoid arthritis: An experimental study [BT/PR4612/MED/30/812/2012]","Dr. Rafat Sultana Ahmed
University College Of Medical Sciences & GTB Hospital Delhi, Delhi-110095","27/03/2012","3 Years 0 Month",2457000.0
1424.0,"MEDICAL BIOTECHNOLOGY - NON-INFECTIOUS DISEASES","Computational modelling and prediction of cerebellar input layer function, timing and plasticity for understanding neurophysiological disorders [BT/PR5142/MED/30/764/2012]","Dr. Shyam  Diwakar
Amrita Vishwa Vidyapeetham (Amrita University) Kollam, Kerala-682026","27/07/2012","3 Years 0 Month",4226000.0
1425.0,"MEDICAL BIOTECHNOLOGY - NON-INFECTIOUS DISEASES","Studies on the modifier capacity of   proto- oncogene(s) during progression of Poly(Q) induced neurodegeneration [BT/PR4937/MED/30/727/2012]","Dr. Surajit  Sarkar
Delhi University, South Campus New Delhi, Delhi-110021","27/08/2012","3 Years 0 Month",4767000.0
1426.0,"MEDICAL BIOTECHNOLOGY - NON-INFECTIOUS DISEASES","A longitudinal study of molecular and cellular changes in intracellualar calcium signaling with neurological correlates in as SCA1 cohort in Sounth India [BT/PR3128/MED/30/860/2012]","Prof. Gaiti  Hasan
National Centre For Biological Sciences Bangalore, Karnataka-560065","27/08/2012","5 Years 0 Month",21852000.0
1427.0,"MEDICAL BIOTECHNOLOGY - NON-INFECTIOUS DISEASES","Neuroprotective properties of selenoergothioneine sourced from selenium-rich mushrooms against oxidative stress and nitrosative damage in neuronal cells [BT/PR4529/MED/30/739/2012]","Dr. Tejo Prakash Nagaraja
Thapar Institute of Engineering & Technology Patiala, Punjab-147004","27/08/2012","2 Years 0 Month",1848000.0
1428.0,"MEDICAL BIOTECHNOLOGY - NON-INFECTIOUS DISEASES","Development of Human Motor-neuron Disease Models in Drosophila. [BT/PR14056/MED/30/351/2010]","Dr. Vimlesh  Kumar
Indian Institute of Science Education and Research (IISER), Bhopal Bhopal, Madhya Pradesh-462023","27/09/2010","3 Years 0 Month",4193028.0
1429.0,"MEDICAL BIOTECHNOLOGY - NON-INFECTIOUS DISEASES","Role of Amygdala in the Modulation of Hippocampal and Prefrontal [BT/PR14044/MED/30/339/2010]","Dr. BS Shankaranaryana Rao
National Institute of Mental Health & Neuro Sciences Bangalore, Karnataka-560029","27/09/2010","3 Years 0 Month",10483024.0
1430.0,"MEDICAL BIOTECHNOLOGY - NON-INFECTIOUS DISEASES","DEVELOPMENT OF ANTI-EPILEPTIC DRUGS: BASED ON MOLECULAR PHYSIOLOGY OF EPILEPSY CAUSING GENE EFHC1 AND AYURVEDIC REMEDIATION [BT/PR14047/MED/30/342/2010]","Prof. Kripamoy  Aguan
North-Eastern Hill University Shillong, Meghalaya-793022","27/09/2010","3 Years 0 Month",10368012.0
1431.0,"MEDICAL BIOTECHNOLOGY - NON-INFECTIOUS DISEASES","Combining Replicating Licensing Proteins Geminin GFAP detla and Histopathological Parameters for Risk Stratification in Astrocytomas [BT/PR14362/MED/30/519/2010]","Dr. Neeta Devi Sinnappah Kang
Christian Medical College & Hospital Ludhiana, Punjab-141008","27/09/2011","2 Years 0 Month",2546008.0
1432.0,"MEDICAL BIOTECHNOLOGY - NON-INFECTIOUS DISEASES","Using a unique genetic tool to study the role of BMP ligands in neurogenesis and gliogenesis in the developing cortex [BT/PR1880/MED/30/624/2011]","Dr. Jonaki  Sen
INDIAN INSTITUTE OF TECHNOLOGY, KANPUR kanpur, Uttar Pradesh-208016","27/09/2011","3 Years 0 Month",5146016.0
1433.0,"MEDICAL BIOTECHNOLOGY - NON-INFECTIOUS DISEASES","Neurobiological Marker for Population Differences: a Neuroeconomic Investigation with Anxiety & Depression Patients contrasted with Normal Population [BT/PR14364/MED/30/521/2010]","Dr. C  Kesavadas
Sree Chitra Tirunal Institute for Medical Sciences & Technology Thiruvananthapuram, Kerala-695012","27/09/2011","2 Years 0 Month",761004.0
1434.0,"MEDICAL BIOTECHNOLOGY - NON-INFECTIOUS DISEASES","Role Of Glypican 3 In The Molecular Pathogenesis Of 
Wilms’ Tumor And Its Value In Prognosis And Treatment  Response [BT/PR3185/MED/30/642/2011]","Dr. Venkateswaran K  Lyer
All India Institute Of Medical Sciences New Delhi, Delhi-110029","28/02/2013","3 Years 0 Month",1699000.0
1435.0,"MEDICAL BIOTECHNOLOGY - NON-INFECTIOUS DISEASES","Effect of continuous positive airway pressure CPAP on biomarkers in patients with obstrructive sleep apnea [BT/PR14194/MED/30/385/2010]","Dr. S K Sharma
All India Institute Of Medical Sciences New Delhi, Delhi-110029","28/03/2012","3 Years 0 Month",6450000.01
1436.0,"MEDICAL BIOTECHNOLOGY - NON-INFECTIOUS DISEASES","Serum soluble urokinase receptor (suPAR) as putative permeability
factor in children with focal segmental glomerulosclerosis and steroid resistant nephrotic syndrome [BT/PR4629/MED/30/814/2012]","Prof. Arvind  Bagga
All India Institute Of Medical Sciences New Delhi, Delhi-110029","28/03/2012","3 Years 0 Month",3733032.0
1437.0,"MEDICAL BIOTECHNOLOGY - NON-INFECTIOUS DISEASES","Validation of the Cancer-Testis Biomarker CABYR in Cervical Squamous Cell
Carcinomas [BT/PR15312/MED/30/601/2011]","Dr. Monika  Sachdev
Central Drug Research Institute Lucknow, Uttar Pradesh-226001","28/03/2012","2 Years 0 Month",2378000.0
1438.0,"MEDICAL BIOTECHNOLOGY - NON-INFECTIOUS DISEASES","Study of brain Insulin/Insulin Receptor in glial cell during  neuroinflammation (National Initiative on Glial Cell Research in Health and Disease) [BT/PR4012/MED/30/672/2011]","Dr. Rakesh  shukla
Central Drug Research Institute Lucknow, Uttar Pradesh-226001","28/03/2012","3 Years 0 Month",3225000.0
1439.0,"MEDICAL BIOTECHNOLOGY - NON-INFECTIOUS DISEASES","To Study the Activation of Glial Cells in Chronic Hypertension (National Initiative on Glial Cell Research in Health and Disease) [BT/PR4021/MED/30/676/2011]","Mr. Kashif  Hanif
Central Drug Research Institute Lucknow, Uttar Pradesh-226001","28/03/2012","3 Years 0 Month",2800000.0
1440.0,"MEDICAL BIOTECHNOLOGY - NON-INFECTIOUS DISEASES","Role and regulation of ceruloplasmin in glial cells in response to norepinephrine (National Initiative on Glial Cell Research in Health and Disease) [BT/PR4005/MED/30/670/2011]","Prof. Chinmay K Mukhopadhyay
Jawaharlal Nehru University New Delhi, Delhi-110067","28/03/2012","3 Years 0 Month",4491000.0
1441.0,"MEDICAL BIOTECHNOLOGY - NON-INFECTIOUS DISEASES","Genetic alterations in the disease progression of chronic myeloid leukemia patients. [BT/PR15235/MED/30/596/2011]","Dr. ALPANA  SAXENA
Maulana Azad Medical College New Delhi, Delhi-110002","28/03/2012","3 Years 0 Month",2541000.12
1442.0,"MEDICAL BIOTECHNOLOGY - NON-INFECTIOUS DISEASES","Regulation of CD44 splicing by tumor suppressor 
SMAR1: Implications in cancer metastasis [BT/PR3624/MED/30/662/2011]","Dr. Samit  Chattopadhyay
National Centre For Cell Science Pune, Maharashtra-411007","28/03/2012","3 Years 0 Month",6859000.0
1443.0,"MEDICAL BIOTECHNOLOGY - NON-INFECTIOUS DISEASES","Identification of candidate biomarkers and molecular networks regulated by human papillomavirus in HNSCC by quantitative proteomic analysis. [BT/PR14846/MED/30/581/2010]","Dr. Naresh K Panda
Post Graduate Institute of Medical Education and Research Chandigarh, Chandigarh-160012","28/03/2012","3 Years 0 Month",4082000.4
1444.0,"MEDICAL BIOTECHNOLOGY - NON-INFECTIOUS DISEASES","Identification of Biomarkers of Clock Disfunction in Aging  and Parkinson’s disease [BT/PR3974/MED/30/813/2012]","Dr. Anita  Jagota
University of Hyderabad Hyderabad, Andhra Pradesh-500046","28/03/2012","3 Years 0 Month",6352500.0
1445.0,"MEDICAL BIOTECHNOLOGY - NON-INFECTIOUS DISEASES","NMR Investigations of Brain Energy Metabolism during Normal Aging and in Alzheimer’s Disease [BT/PR14064/MED/30/359/2010]","Dr. Anant B Patel
Centre For Cellular And Molecular Biology Hyderabad, Andhra Pradesh-500007","28/09/2010","3 Years 0 Month",8644020.0
1446.0,"MEDICAL BIOTECHNOLOGY - NON-INFECTIOUS DISEASES","Functional neuronal differentiation of human cord blood stem cells: tool to study the chemical induced developmental neurotoxicity [BT/PR14075/MED/30/368/2010]","Dr. A B Pant
Indian Institute of Toxicology Research Lucknow, Uttar Pradesh-226001","28/09/2010","3 Years 0 Month",5165024.0
1447.0,"MEDICAL BIOTECHNOLOGY - NON-INFECTIOUS DISEASES","A STUDY OF ROLE OF NUCLEUS ACCUMBENS AND RELATED SUBCORTICAL CENTERS IN ADDICTION AND CONSUMMATORY BEHAVIOUR OF MALE WISTAR ALBINO RATS [BT/PR14012/MED/30/315/2010]","Dr. Ganaraja  B
Kasturba Medical College, Mangalore Mangalore, Karnataka-575001","28/09/2010","3 Years 0 Month",3618024.0
1448.0,"MEDICAL BIOTECHNOLOGY - NON-INFECTIOUS DISEASES","Neurodegenration in developing rat brain with experimental flurosis- studies on excitotoxicity and microgial activatio mechanism [BT/PR14040/Med/30/336/2010]","Dr. K Pratap Reddy
Osmania University Hyderabad, Andhra Pradesh-500007","28/09/2010","3 Years 0 Month",4150000.0
1449.0,"MEDICAL BIOTECHNOLOGY - NON-INFECTIOUS DISEASES","Characterization of platelet senescence-linked internal timer and its effect on prothrombotic state [BT/PR4095/MED/30/678/2011]","Dr. Debabrata  Dash
Banaras Hindu University Varanasi, Uttar Pradesh-221005","28/09/2012","3 Years 0 Month",7924000.21
1450.0,"MEDICAL BIOTECHNOLOGY - NON-INFECTIOUS DISEASES","Imaging and biochemical analysis of subversion of innate immune cells by glycoprotein’s of pathogenic  mycobacteria. [BT/PR3145/MED/30/638/2011]","Prof. S  Vijaya
INDIAN INSTITUTE OF SCIENCE Bangalore, Karnataka-560012","28/09/2012","3 Years 0 Month",7023000.0
1451.0,"MEDICAL BIOTECHNOLOGY - NON-INFECTIOUS DISEASES","Unraveling the role of glucose metabolism in neurodegenerative disorders [BT/PR4871/MED/30/726/2012]","Prof. Subramaniam  Ganesh
INDIAN INSTITUTE OF TECHNOLOGY, KANPUR kanpur, Uttar Pradesh-208016","28/09/2012","3 Years 0 Month",5848000.0
1452.0,"MEDICAL BIOTECHNOLOGY - NON-INFECTIOUS DISEASES","To gain functional insight of HapR and its natural variants: Underscore the influence of HapR in the survival and pathogenesis of vibrio cholerae: Lessons from Vibrio cholerae quorum sensing network [BT/PR3583/MED/30/659/2011]","Dr. Saumya  Ray Chaudhari
INSTITUTE OF MICROBIAL TECHNOLOGY Chandigarh, Chandigarh-160036","28/09/2012","3 Years 0 Month",3363000.0
1453.0,"MEDICAL BIOTECHNOLOGY - NON-INFECTIOUS DISEASES","Embryonic zebrafish as a model system to study the expression and role of breast tumour kinase(brk/ptk6) [BT/PR13201/MED/30/246/2009]","Dr. Kiranam  Chatti
INSTITUTE OF LIFE SCIENCES Bhubaneswar, Andhra Pradesh-751023","29/03/2010","3 Years 0 Month",3992020.0
1454.0,"MEDICAL BIOTECHNOLOGY - NON-INFECTIOUS DISEASES","Epigenetic and Transcription regulatory mechanisms in
glial functions in physiology and etiopathophysiology
(National Initiative on
Glial Cell Research in Health
and Disease) [BT/PR4014/MED/30/673/2011]","Dr. Arvind  Kumar
Centre For Cellular And Molecular Biology Hyderabad, Andhra Pradesh-500007","29/03/2012","3 Years 0 Month",7199000.0
1455.0,"MEDICAL BIOTECHNOLOGY - NON-INFECTIOUS DISEASES","Impact of maternal protein malnutrition on the genesis, differentiation and maturation of astrocytes and oligodendrocytes
(National Initiative on
Glial Cell Research in Health
and Disease) [BT/PR4001/MED/30/669/2011]","Dr. Ishan  Patro
Jiwaji University Gwalior, Madhya Pradesh-474011","29/03/2012","3 Years 0 Month",8068000.0
1456.0,"MEDICAL BIOTECHNOLOGY - NON-INFECTIOUS DISEASES","Perinatal viral infection neuroimmunological, moleular and cognitive consequences during development adulthood and senility in mice. [BT/PR14311/MED/30/470/2010]","Dr. Ishan  Patro
Jiwaji University Gwalior, Madhya Pradesh-474011","29/03/2012","3 Years 0 Month",8634000.0
1457.0,"MEDICAL BIOTECHNOLOGY - NON-INFECTIOUS DISEASES","Pulse sequence (in vivo) and processing scheme development for anesthetics and amyloid beta peptide
interactions using 19F MRS [BT/PR5386/MED/30/816/2012]","Dr. Pravat Kumar Mandal
National Brain Research Centre Gurgaon, Haryana-122050","29/03/2012","2 Years 0 Month",1373200.0
1458.0,"MEDICAL BIOTECHNOLOGY - NON-INFECTIOUS DISEASES","Understanding the effect of Adiponectin mediated signaling pathways on retinal degeneration using human retinal explant culture for designing efficient neuroprotective agent [BT/PR5055/MED/30/761/2012]","Dr. Subbulakshmi  Chidambaram
Vision Research Fondation, Sankara Nethralaya, Chennai Chennai, Tamilnadu-600006","29/09/2012","3 Years 0 Month",4373000.0
1459.0,"MEDICAL BIOTECHNOLOGY - NON-INFECTIOUS DISEASES","COGNITIVE CONTROL OF PERCEPTION AND ACTION [BT/PR2999/MED/30/635/2011]","Dr. SP  Arun
INDIAN INSTITUTE OF SCIENCE Bangalore, Karnataka-560012","30/01/2013","3 Years 0 Month",7987000.0
1460.0,"MEDICAL BIOTECHNOLOGY - NON-INFECTIOUS DISEASES","Structure, function and interactions of neuronal calcium sensors in neurophysiology [BT/PR14035/MED/30/333/2010]","Dr. Yogendra  Sharma
Centre For Cellular And Molecular Biology Hyderabad, Andhra Pradesh-500007","30/11/2010","3 Years 0 Month",6587020.0
