513.0,"BIOINFORMATICS R&D PROJECTS","Molecular Dynamics Studies of the Homology Model of CYP1A1, Structure Based Drug Design and Virtual Screening of Potential Ligands that Modulates the Biological Function of CYP1A1 [BT/PR/14979/BID/07/353/2010]","Dr. Abhay Tulshiram Sangamwar
National Institute of Pharmaceutical Education And Research (NIPER) - Mohali Mohali, Punjab-160062","02/01/2012","3 Years 0 Month",3804200.0
514.0,"BIOINFORMATICS R&D PROJECTS","Establishment of National Database on Tuberculosis (TB) [BT/PR15457/BID/07/364/2011]","Dr. Kiran  Katoch
National Jalma Institute For Leprosy And Other Mycobacterial Diseases Agra, Uttar Pradesh-282001","02/06/2011","3 Years 0 Month",39351400.0
515.0,"BIOINFORMATICS R&D PROJECTS","Bioinformaics Study on the Recognition and Dynamic of the water Molecules in the Human Inosine Monophosphate Dehydrogenase (IMPDHII) and Inhibitor Design [BT/PR11696/BID/07/282/2008]","Dr. B P Mukhopadhyay
National Institute of Technology, Durgapur Durgapur West Bangal, West Bengal-713209","02/08/2010","3 Years 0 Month",2264400.0
516.0,"BIOINFORMATICS R&D PROJECTS","Study of some important signalling and metabolic pathways in T-cell and glioma [BT/PR13689/BID/07/363/2010]","Dr. Ram Rup Sarkar
Centre For Cellular And Molecular Biology Hyderabad, Andhra Pradesh-500007","04/08/2011","3 Years 0 Month",2606920.0
517.0,"BIOINFORMATICS R&D PROJECTS","CLUGENE: A Clustering Tool for Gene Expression Data [BT/PR3741/BID/7/382/2011]","Dr. K  Premalatha
Bannari Amman Institute Of Technology Erode, Tamilnadu-638401","06/09/2012","3 Years 0 Month",1065999.88
518.0,"BIOINFORMATICS R&D PROJECTS","In silico Investigation of Mechanism Based Inhibition of CYPs [BT/PR14837/BID/07/348/2010]","Prof. Prasad V Bharatam
National Institute of Pharmaceutical Education And Research (NIPER) - Mohali Mohali, Punjab-160062","06/09/2012","3 Years 0 Month",4058999.76
519.0,"BIOINFORMATICS R&D PROJECTS","ROLE OF PROTEIN COMPLEXES AND PROTEIN PROTEIN INTERACTION NETWORK IN EUKARYOTIC PROTEIN EVOLUTION [BT/PR692/BID/7/369/2011]","Prof. Tapash Chandra Ghosh
Bose Institute Kolkata, West Bengal-700054","09/12/2011","3 Years 0 Month",2411400.0
520.0,"BIOINFORMATICS R&D PROJECTS","Establishment of National Database on Rice. [BT/PR11184/BID/07/263/2008]","Dr. S K Sharma
National Bureau of Plant Genetic Resources New Delhi, Delhi-110012","12/08/2009","5 Years 0 Month",71613800.0
521.0,"BIOINFORMATICS R&D PROJECTS","Development of bioinformatics methods for identifying novel secondary metabolites by genome mining [BT/PR13526/BID/07/311/2010]","Dr. Debashis  Mohanty
National Institute of Immunology New Delhi, Delhi-110067","14/02/2013","3 Years 0 Month",3741600.0
522.0,"BIOINFORMATICS R&D PROJECTS","Drug Target Identification in L.major and S.mansoni through Biochemical Network Modeling [BT/PR3140/BID/7/379/2011]","Dr. Shailza  Singh
National Centre For Cell Science Pune, Maharashtra-411007","14/06/2012","3 Years 0 Month",2181999.76
523.0,"BIOINFORMATICS R&D PROJECTS","Development of new phasing tools for faster
macromolecular structure determination [BT/PR3084/BID/07/377/2011]","Dr. Amit  Sharma
International Centre for Genetic Engineering &  Biotechnology New Delhi, Delhi-110067","15/03/2012","3 Years 0 Month",7218020.0
524.0,"BIOINFORMATICS R&D PROJECTS","Mechanistic insight into the role of conformational Modulations in driving BC12s apoptotic network: Structural dynamics to therapeutic design [BT/PR793/BID/7/370/2011]","Dr. Shubhra  Ghosh Dastidar
Bose Institute Kolkata, West Bengal-700054","16/02/2012","3 Years 0 Month",6400000.0
525.0,"BIOINFORMATICS R&D PROJECTS","In silico understanding of structures, stability and dynamics of RNA riboswitches energetics and MD simulations using QM and MM methods. [BT/PR11429/BID/07/272/2008]","Dr. Dhananjay  Bhattacharyya
Saha Institute of Nuclear Physics Kolkata, West Bengal-700064","16/03/2010","3 Years 0 Month",4928800.0
526.0,"BIOINFORMATICS R&D PROJECTS","Discovery, annotation, validation and characterization of SNPs in Wheat (Triticum aestivum L.) and haplotype structure determination using Next-Generation Sequencing Data [BT/PR3925/BID/7/384/2011]","Prof. Kunal  Mukhopadhyay
Birla Institute Of Technology, Ranchi Ranchi, Jharkhand-835215","16/03/2012","3 Years 0 Month",4979999.64
527.0,"BIOINFORMATICS R&D PROJECTS","COMPUTATIONAL ANALYSIS AND ALTERNATIVELY SPLICED TRANSCRIPTS OF CANCER ASSOCIATED GENES FROM MOUSE GENOME [BT/PR5271/BID/7/395/2012]","Dr. Mohammad  Tabish
Aligarh Muslim University Aligarh, Uttar Pradesh-202002","17/07/2012","3 Years 0 Month",990000.0
528.0,"BIOINFORMATICS R&D PROJECTS","Computer-Aided Fundus Image Analyzer for Diabetic Retinopathy Screening [BT/PR14073/BID/07/320/2010]","Dr. chandan  Chakraborty
INDIAN INSTITUTE OF TECHNOLOGY, KHARAGPUR Kharagpur, West Bengal-721302","19/02/2013","3 Years 0 Month",2066000.0
529.0,"BIOINFORMATICS R&D PROJECTS","Computational design of some novel, non pteridine analogs as selective
Mycobacterium tuberculosis dihydrofolate reductase inhibitors [BT/PR14509/BID/07/333/2010]","Dr. Mymoona  Akhtar
Jamia Hamdard University New Delhi, Delhi-110062","19/02/2013","3 Years 0 Month",4060000.0
530.0,"BIOINFORMATICS R&D PROJECTS","Development of National Database on Mango [BT/PR14148/BID/07/326/2010]","Dr. Shailendra  Rajan
Central Institute For Subtropical Horticulture Lucknow, Uttar Pradesh-227107","20/02/2013","5 Years 0 Month",39903200.0
531.0,"BIOINFORMATICS R&D PROJECTS","A sturctural insight towards Human neuronal a7 nicotinic Acetylcholine Receptor in Response to Neurotoxins and Neurotransmitters. [BT/PR10792/BID/07/251/2008]","Dr. P  Shanmughavel
Bharathiar University Coimbatore, Tamilnadu-641046","20/04/2010","3 Years 0 Month",2317600.0
532.0,"BIOINFORMATICS R&D PROJECTS","Comparative Genomic & Proteomic studies of the multi domain Cellulase enzyme from different organisms [BT/PR13603/BID/07/312/2010]","Dr. Hetalkumar J Panchal
Sardar Patel University Vallabh Vidhyanagar, Gujarat-388120","20/06/2012","1 Years 0 Month",264800.0
533.0,"BIOINFORMATICS R&D PROJECTS","Molecular Modeling and Identification of small Molecule Inhibitors for BRCT Domains in Different Proteins Involved in the Pathways of Tumor Formation - a Bioinformatics Approach to Predict Cancer risk [BT/PR12565/BID/07/303/2009]","Dr. Ashok Kumar Varma
Advanced Centre For Treatment Research & Education In Cancer Mumbai, Maharashtra-410210","20/07/2010","3 Years 0 Month",4095200.0
534.0,"BIOINFORMATICS R&D PROJECTS","Computational Analysis of AT – Rich Genomes : Implication for the P. Falciparum Genome at a Protemic Level [BT/PR14511/BID/07/335/2010]","Dr. Amit  Sharma
International Centre for Genetic Engineering &  Biotechnology New Delhi, Delhi-110067","21/02/2011","3 Years 0 Month",4596800.0
535.0,"BIOINFORMATICS R&D PROJECTS","Buffalo Genome Information Resource [BT/PR/15046/BID/07/355/2011]","Dr. Sachinandan  De
National Dairy Research Institute Karnal, Haryana-132001","21/03/2012","2 Years 0 Month",3756800.0
536.0,"BIOINFORMATICS R&D PROJECTS","Structure Determination  of CPS and AtCase of Thermus thermophilus HB8 and identification of potential inhibitors [BT/PR4524/BID/7/388/2012]","Dr. Jeyaraman  Jeyakanthan
Alagappa University Karaikudi, Tamilnadu-630003","21/08/2012","3 Years 0 Month",3216000.0
537.0,"BIOINFORMATICS R&D PROJECTS","Identification of Amino Acid Residues Involved in Substrate Specificity of Bacterial Ring Hydroxylating Dioxytgenases Using Bioinformatics Approach [BT/PR11831/BID/07/290/2009]","Dr. Tapan K Dutta
Bose Institute Kolkata, West Bengal-700054","21/09/2010","3 Years 0 Month",3175600.0
538.0,"BIOINFORMATICS R&D PROJECTS","Molecular modeling study of the effect of the glycosylation on protein structure and dynamics [BT/PR13421/BID/07/307/2009]","Dr. AVADHESHA  SUROLIA
INDIAN INSTITUTE OF SCIENCE Bangalore, Karnataka-560012","21/09/2010","3 Years 0 Month",6301060.0
539.0,"BIOINFORMATICS R&D PROJECTS","Construction of computational platform for the identification of noncoding small RNAs and small ORFs in bacteria [BT/PR522/BID/7/365/2011]","Dr. J  Sridhar
Madurai Kamraj University Madurai, Tamilnadu-625021","22/02/2012","3 Years 0 Month",1835000.0
540.0,"BIOINFORMATICS R&D PROJECTS","A kinomic approach towards understanding of kinase inhibiters by applying a molecular docking and pathway profiling approach its implications for rational design of novel kinase inhibitors [BT/PR14691/BID/07/346/2010]","Dr. Venkata Sai Badireenath Konkimalla
National Institute of Science Education And Research Bhubaneswar, Orissa-751005","22/02/2012","3 Years 0 Month",1876000.0
541.0,"BIOINFORMATICS R&D PROJECTS","Comparative structural analysis of substrate specificity in astacin 
metalloendopeptidases by homology modelling [BT/PR14898/BID/07/351/2010]","Dr. Sibani  Chakraborty
West Bengal State University Kolkata, West Bengal-700126","22/02/2012","3 Years 0 Month",3015000.0
542.0,"BIOINFORMATICS R&D PROJECTS","The Evolution of Cardiac G Protein – Coupled Receptors in Metazoa [BT/PR11748/BID/07/285/2008]","Dr. N  Manoj
INDIAN INSTITUTE OF TECHNOLOGY, MADRAS Chennai, Tamilnadu-600036","22/03/2011","3 Years 0 Month",1412800.0
543.0,"BIOINFORMATICS R&D PROJECTS","Modeling Molecular Dynamics Simulations and computer Aided Drug Design Studies of Viroporins, HIV – VPU and SARS – COV 3A [BT/PR12729/BID/07/297/2009]","Dr. U Deva Priyakumar
International Institute of Information Technology, Hyderabad Hyderabad, Andhra Pradesh-500032","22/03/2011","3 Years 0 Month",6145600.0
544.0,"BIOINFORMATICS R&D PROJECTS","Development of efficient p-glycoprotein inhibitors based on structure based drug design (SBDD) and in silicon comparative studies [BT/PR14653/BID/07/344/2010]","Dr. Shah Anamik kantilal
Saurashtra University Rajkot, Gujarat-360005","22/05/2012","3 Years 0 Month",4670000.0
545.0,"BIOINFORMATICS R&D PROJECTS","Identification of penta-peptide and large identical inverted repeat sequences in proteins and analysis of their corresponding structural features and possible functional role [BT/PR3947/BID/7/401/2012]","Dr. Kunchur  Guruprasad
Centre For Cellular And Molecular Biology Hyderabad, Andhra Pradesh-500007","22/08/2012","3 Years 0 Month",2539999.52
546.0,"BIOINFORMATICS R&D PROJECTS","Incorporating conformational flexibility and solvent environment into protein protein docking algorithm [BT/PR13897/BID/07/316/2010]","Prof. Debnath  Pal
INDIAN INSTITUTE OF SCIENCE Bangalore, Karnataka-560012","23/03/2011","3 Years 0 Month",2209024.0
547.0,"BIOINFORMATICS R&D PROJECTS","Studies on the Binding Specificities of Gonadotropins and Their Receptors [BT/PR12904/BID/07/301/2009]","Dr. Susan  Thomas
National Institute For Research In Reproductive Health Mumbai, Maharashtra-400012","24/11/2010","3 Years 0 Month",3073000.0
548.0,"BIOINFORMATICS R&D PROJECTS","CASE BASED REASONING IN THE DETECTION OF ABNORMALITIES IN RETINA IMAGES [BT/PR4256/BID/7/393/2012]","Dr. Sreeparna  Banerjee
West Bengal University of Technology Kolkata, West Bengal-700064","25/07/2012","2 Years 0 Month",650000.0
549.0,"BIOINFORMATICS R&D PROJECTS","Loop Modeling in Nucleic Acid Structures [BT/PR11192/BID/07/264/2008]","Dr. G  Savitha
Birla Institute of Technology - Pilani- Hydrabad Hyderabad, Andhra Pradesh-500078","25/11/2010","3 Years 0 Month",4712000.0
550.0,"BIOINFORMATICS R&D PROJECTS","Understanding Systems Biology of a Rhizobacterium Azospirillum brasilense by in-Silico and in-vitro study of the cascades and Networks of Sigma Factors, Anti – Anti Sigma Factors [BT/PR14514/BID/07/338/2010]","Dr. Anil Kumar Tripathi
Banaras Hindu University Varanasi, Uttar Pradesh-221005","27/06/2011","3 Years 0 Month",3070000.0
551.0,"BIOINFORMATICS R&D PROJECTS","Plant parasitic nematode genome informatics - insilico resource development. [BT/PR5163/BID/7/397/2012]","Dr. Uma  Rao
Indian Agricultural Research Institute New Delhi, Delhi-110012","27/09/2012","3 Years 0 Month",3659600.0
552.0,"BIOINFORMATICS R&D PROJECTS","Designing Inhibitors against Beta-lactamases Putative Drug Candidates against Drug Resistant bacterial Strains of Infectious Diseases [BT/PR12553/BID/O7/296/2009]","Dr. Asad Ullah Khan
Aligarh Muslim University Aligarh, Uttar Pradesh-202002","28/05/2010","3 Years 0 Month",3620808.0
553.0,"BIOINFORMATICS R&D PROJECTS","Whole genome survey of microRNA target site accessibility based on conserved local RNA secondary structure and protein binding site overlaps: Creating a Freely Accessible Web Resource [BT/PR14209/BID/07/328/2010]","Dr. M Radhakrishna Pillai
Rajiv Gandhi Centre For Biotechnology Thiruvananthapuram, Kerala-695014","29/03/2012","3 Years 0 Month",1948000.0
554.0,"BIOINFORMATICS R&D PROJECTS","Mycorrhiza Information and Resource Centre [BT/PR11830/BID/07/289/2009]","Dr. T P Sankar
The Energy And Resources Institute, New Delhi New Delhi, Delhi-110003","30/03/2010","3 Years 0 Month",1046800.0
555.0,"BIOINFORMATICS R&D PROJECTS","Biomedical Literature Mining to Find Drug-Targetable Pathways  of Mycobacterium Tuberculosis [BT/PR15378/BID/07/361/2011]","Dr. N  Jeyakumar
Bharathiar University Coimbatore, Tamilnadu-641046","30/04/2012","3 Years 0 Month",4314400.0
556.0,"BIOPESTICIDES AND CROP MANAGEMENT","DEVELOPMENT OF SUITABLE FORMULATION USING INDIGENOUS STRAINS OF NE INDIA FOR CROP IMPROVEMENT 
: A COMBINED HOLISTIC APPROACH [BT/PR14247/AGR/05/516/2010]","Dr. S Indira  Devi
INSTITUTE OF BIORESOURCES AND SUSTAINABLE DEVELOPMENT Imphal, Manipur-795001","02/03/2012","3 Years 0 Month",17073400.0
557.0,"BIOPESTICIDES AND CROP MANAGEMENT","Isolation of Pheromone- a contribution towards Integrated Pest
Management [BT/PR14524/AGR/05/520/2010]","Dr. Dolly  Kumar
M. S. University of Baroda Vadodara, Gujarat-390001","02/05/2012","3 Years 0 Month",2969000.0
558.0,"BIOPESTICIDES AND CROP MANAGEMENT","Genetic and  functional analysis of novel genes from Photorhabdus luminescens and Xenorhabdus nematophilus symbiotic bacteria associated with entomopathogenic nematodes for insect pest management [BT/PR10919/AGR/05/427/2008]","Dr. M  Nagesh
National Bureau of Agriculturally Important Insects Bangalore, Karnataka-560024","03/07/2009","4 Years 0 Month",9163012.0
559.0,"BIOPESTICIDES AND CROP MANAGEMENT","Lytic Bacteriophages as a Biorational Biocontrol Agent 
Against the Bacterial Wilt Disease of Brinjal [BT/PR4810/AGR/5/572/2012]","Dr. M  Senthilkumar
Tamil Nadu Agricultural University Coimbatore, Tamilnadu-641003","03/09/2012","3 Years 0 Month",2926000.0
560.0,"BIOPESTICIDES AND CROP MANAGEMENT","Development of PGPR formulations for the management of rhizome rot of turmeric [BT/PR13718/AGAR/05/498/2010]","Dr. Mathivanan  Narayanasamy
University of Madras Chennai, Tamilnadu-600005","06/06/2011","3 Years 0 Month",4271600.0
561.0,"BIOPESTICIDES AND CROP MANAGEMENT","DEVELOPMENT AND EVALUATION OF ISOTONIC AQUEOUS FORMULATION OF CHAETOMIUM GLOBOSUM FOR THE MANAGEMENT OF FOLIAR AND SOIL BORNE DISEASES OF POTATO [BT/PR6334/AGR/5/588/2012]","Dr. Raguchander  thiruvengadam
Tamilnadu Agricultural University Coimbatore, Tamilnadu-641003","07/08/2012","3 Years 0 Month",1930200.0
562.0,"BIOPESTICIDES AND CROP MANAGEMENT","Development of fungal bionematicide: Scale up, post harvest processing, storage stability, toxicology and field evaluation [BT/PR10401/AGR/05/408/2008]","Dr. M  Nagesh
National Bureau of Agriculturally Important Insects Bangalore, Karnataka-560024","08/06/2009","4 Years 0 Month",6075812.0
563.0,"BIOPESTICIDES AND CROP MANAGEMENT","Mass production of Bacillus subtiles for biocontrol of sapstain on rubber wood [BT/PR14542/AGR/05/527/2010]","Dr. EJ Maria Florence
Kerala Forest Research Institute Thrissur, Kerala-680653","08/08/2011","3 Years 0 Month",1631200.0
564.0,"BIOPESTICIDES AND CROP MANAGEMENT","Bioprospecting for chitinolytic micro-organisms and their potential in insect biocontrol [BT/PR12789/AGR/05/476/2009]","Dr. Sangeeta  Paul
Indian Agricultural Research Institute New Delhi, Delhi-110012","08/12/2010","3 Years 0 Month",3731740.0
565.0,"BIOPESTICIDES AND CROP MANAGEMENT","BIOLOGICAL CONTROL OF SPODOPTERA LITURA WITH ENTOMOPATHOGENIC NEMATODES [BT/PR920/AGR/5/546/2011]","Prof. Amin Uddin Siddiqui
Maharana Pratap University of Agriculture And Technology Udaipur, Rajasthan-313001","09/11/2012","3 Years 0 Month",2773000.0
566.0,"BIOPESTICIDES AND CROP MANAGEMENT","PLANT GROWTH PROMOTING RHIZOBACTERIA (PGPR) FOR THE MANAGEMENT OF MAJOR SEED-BORNE DISEASES AND ENHANCEMENT OF SEED QUALITY OF VEGETABLES AND PLANTING MATERIALS FOR NORTH EASTERN REGION OF INDIA [BT/PR13884/AGR/05/504/2010]","Dr. Manjunath  Prasad
Indian Agricultural Research Institute New Delhi, Delhi-110012","09/12/2010","3 Years 0 Month",6246056.0
567.0,"BIOPESTICIDES AND CROP MANAGEMENT","Genome minnig  of plant associated endophytic bacteria for natural products. [BT/PR13785/AGR/05/511/2010]","Dr. AUNDY  KUMAR
Indian Agricultural Research Institute New Delhi, Delhi-110012","11/10/2011","3 Years 0 Month",7570036.0
568.0,"BIOPESTICIDES AND CROP MANAGEMENT","Bioprospecting of indigenous Trichoderma & Pseudomonas fluorescens strains from NE India as potential bioinoculant with increase shelf-life & better biocontrol efficacy [BT/PR1222/AGR/5/548/2011]","Dr. S Indira  Devi
INSTITUTE OF BIORESOURCES AND SUSTAINABLE DEVELOPMENT Imphal, Manipur-795001","11/11/2011","3 Years 0 Month",3448800.0
569.0,"BIOPESTICIDES AND CROP MANAGEMENT","Development of broad spectrum liquid formulation of biopesticides for management of vegetable diseases [BT/PR5990/AGR/5/587/2012]","Dr. H B Singh
National Botanical Research Institute Lucknow, Uttar Pradesh-226001","13/02/2013","3 Years 0 Month",4836400.0
570.0,"BIOPESTICIDES AND CROP MANAGEMENT","Development of bio-pesticide formulation for reducing postharvest losses and for achieving export quality and increased shelf –life of banana fruits [BT/PR6357/AGR/5/592/2012]","Dr. Thangavelu  Raman
National Research Centre For Banana Tiruchirappalli, Tamilnadu-620102","13/02/2013","3 Years 0 Month",2654012.0
571.0,"BIOPESTICIDES AND CROP MANAGEMENT","Developing Strategies for Biological Control of Spodoptera litura (Fab.) by Understanding the Role of Gut Microflora in its Survival and Fitness [BT/PR14708/AGR/05/525/2010]","Dr. Sanehdeep  Kaur
Guru Nanak Dev University Amritsar, Punjab-143001","13/09/2012","3 Years 0 Month",3535400.0
572.0,"BIOPESTICIDES AND CROP MANAGEMENT","Quorum quenching bio control approach of Bacillus spp. [BT/PR3474/AGR/5/559/2011]","Dr. Anuradha S Nerurkar
M. S. University of Baroda Vadodara, Gujarat-390001","13/09/2012","3 Years 0 Month",3676000.0
573.0,"BIOPESTICIDES AND CROP MANAGEMENT","DEVELOPMENT OF SEX PHEROMONE AND PEST BEHAVIOUR MEDIATED FIELD TECHNOLOGY FOR THE MANAGEMENT OF MANGO FRUIT BORER, DEANOLIS ALBIZONALIS (HAMPSON) IN EASTERN INDIA [BT/PR10810/AGR/05/426/2008]","Dr. H S singh
Indian Institute of Horticultural Research Bangalore, Orissa-560089","14/06/2010","3 Years 0 Month",2303012.0
574.0,"BIOPESTICIDES AND CROP MANAGEMENT","Differential plant volatile emission: unfolding the new mechanism of host plant resistance against important insect pests of sweetpotato [BT/PR15258/AGR/05/539/2011]","Dr. Korada Rajasekhara Rao
Regional Centre of Central Tuber Crops Research Institute Bhubaneswar, Orissa-751009","14/12/2011","3 Years 0 Month",2307016.0
575.0,"BIOPESTICIDES AND CROP MANAGEMENT","Tritrophic interactions mediated by induced defence volatiles in sorghum [BT/PR15037/AGR/05/535/2011]","Dr. P G Padmaja
Directorate of Sorghum Research (Formerly NRCS) Hyderabad, Andhra Pradesh-500030","15/03/2012","3 Years 0 Month",6844200.0
576.0,"BIOPESTICIDES AND CROP MANAGEMENT","DEVELOPMENT OF RECOMBINANT BECULOVIRUS BIOPESTICIDE FOR THE BIOLOGICAL CONTROL OF THE  INSECT PEST BIHAR HAIRY CATERPILLAR (SPILOSOMA OBLIQUA) ON MAJOR FOOD CROPS IN INDIA [BT/PR12602/AGR/05/469/2009]","Dr. D M Mamatha
Sri Padmavati Mahila Visvavidyalayam Tirupati, Andhra Pradesh-517502","16/04/2010","3 Years 0 Month",3397004.0
577.0,"BIOPESTICIDES AND CROP MANAGEMENT","Exploitation of lipopolysaccharides producing PGPR in the development of aqueous formulation for the management of nematode - disease complex in high value export oriented Floriculture crops [BT/PR15366/AGR/05/538/2011]","Prof. E I  Jonathan
Tamil Nadu Agricultural University Coimbatore, Tamilnadu-641003","18/04/2012","3 Years 0 Month",3426750.0
578.0,"BIOPESTICIDES AND CROP MANAGEMENT","Biological control of fungal root rot disease of mulberry by entophytic bacteria Burkholderia cepacia and Bacillus subtilis strains [BT/PR13723/AGR/05/500/2010]","Dr. V  Gunasekher
Central Sericulture Research & Training Instt. Mysore, Karnataka-570008","18/11/2010","3 Years 0 Month",1315016.0
579.0,"BIOPESTICIDES AND CROP MANAGEMENT","Development of bio-control strategies for the management of wilt disease complex in tomato and capsicum [BT/PR10623/AGR/05/421/2008]","Dr. Davis Joseph Bagyaraj
Center For Natural Biological Resources And Community Development Bangalore, Karnataka-560024","19/03/2010","3 Years 0 Month",3543000.0
580.0,"BIOPESTICIDES AND CROP MANAGEMENT","Integrated management of ginger rhizome rot complex and demonstration of management practices to ginger cultivators in Nagaland [BT/PR9055/AGR/05/369/2007]","Dr. L  Daiho
Nagaland University Zunheboto, Nagaland-798627","20/09/2010","3 Years 0 Month",2025020.0
581.0,"BIOPESTICIDES AND CROP MANAGEMENT","RAPID PURIFICATION AND CHARACTERIZATION OF PROTEINASE INHIBITORS FROM CULTIVARS AND WILD-TYPES OF CAJANUS CAJAN ACTIVE AGAINST LEPIDOPTERAN INSECTS [BT/PR13261/AGR/05/489/2009]","Dr. K P M S V Padmasree
University of Hyderabad Hyderabad, Andhra Pradesh-500046","20/12/2010","3 Years 0 Month",5990020.0
582.0,"BIOPESTICIDES AND CROP MANAGEMENT","Evaluation of indigenous strain of  fungal pathogen Beauveria  bassiana against Helopeltis spp on guava, cashew and tea [BT/PR15456/AGR/05/542/2011]","Dr. P N Ganga Visalakshy
Indian Institute of Horticultural Research Bangalore, Karnataka-560089","21/08/2012","3 Years 0 Month",2636800.0
583.0,"BIOPESTICIDES AND CROP MANAGEMENT","Bioresource technology in India-Biosurfactants as fungicides against zoosporic plant pathogens [BT/PR12785/AGR/05/475/2009]","Dr. Rajendra  Hegde
Vittal Mallya Scientific Research Foundation Bangalore, Karnataka-560076","21/09/2010","3 Years 0 Month",4613016.0
584.0,"BIOPESTICIDES AND CROP MANAGEMENT","Lipase Producing Microbes as biopesticide - Novel approach to mealybug control. [BT/PR12694/AGR/05/474/2009]","Dr. Satish Vitthal Patil
North Maharashtra University Jalgaon, Maharashtra-425001","22/06/2010","3 Years 0 Month",1231000.0
585.0,"BIOPESTICIDES AND CROP MANAGEMENT","Development of liquid formulation of bio-fungicide Trichoderma viride. [BT/PR12621/AGR/05/472/2009]","Dr. A  Kamalakannan
Tamil Nadu Agricultural University Coimbatore, Tamilnadu-641003","23/06/2010","3 Years 0 Month",2653500.0
586.0,"BIOPESTICIDES AND CROP MANAGEMENT","Essential oil allelochemicals and their derivatives as biorational insecticides [BT/PR13082/AGR/05/487/2009]","Dr. Opender  Koul
INSECT BIOPESTICIDE RESEARCH CENTRE Jalandhar, Punjab-144003","25/05/2011","3 Years 0 Month",2333800.0
587.0,"BIOPESTICIDES AND CROP MANAGEMENT","Molecular approaches for the control of Odoiporus longicollis (Oliver) a major pest of banana [BT/PR14814/AGR/05/530/2010]","Dr. Lalitha Sunil Kumar
National Chemical Laboratory Pune, Maharashtra-411008","26/09/2012","3 Years 0 Month",4980200.0
588.0,"BIOPESTICIDES AND CROP MANAGEMENT","Identifying a potential biocontrol agent against an invasive mealy bug, Paracoccus marginatus Williams and Granara de willink [BT/PR13551/AGR/05/496/2010]","Dr. S  Suresh
Tamil Nadu Agricultural University Coimbatore, Tamilnadu-641003","26/10/2010","3 Years 0 Month",2178020.0
589.0,"BIOPESTICIDES AND CROP MANAGEMENT","Harnessing PGPRs from Indo Gangetic Plain Region of Uttar Pradesh for Growth Promotion and Disease Suppression in Rice and Pigeonpea [BT/PR469/AGR/05/545/2011]","Dr. Shivesh  Sharma
Motilal Nehru National Institute of Technology Allahabad, Uttar Pradesh-211004","26/12/2011","3 Years 0 Month",3939000.0
590.0,"BIOPESTICIDES AND CROP MANAGEMENT","Development of kairomone based IPM Modules for the Management Lepidopteron Pests of vegetables Crop. [BT/PR11078/AGR/05/440/2008]","Dr. RK  Muralidharan
Tamil Nadu Agricultural University Coimbatore, Tamilnadu-641003","27/07/2011","3 Years 0 Month",1149000.0
591.0,"BIOPESTICIDES AND CROP MANAGEMENT","Secondary metabolites of entomopathogenic microbes to control Helicoverpa armigera [BT/PR13824/AGR/05/508/2010]","Dr. S  GOPALAKRISHNAN
INTERNATIONAL CROPS RESEARCH INSTT. FOR THE SEMI-ARID TROPIS Hyderabad, Andhra Pradesh-502324","27/09/2011","3 Years 0 Month",5138600.0
592.0,"BIOPESTICIDES AND CROP MANAGEMENT","Evaluation of antagonistic fluorescent pseudomonad bacteria for the disease management in the north-east region [BT/PR14242/AGR/05/515/2010]","Dr. N  Sakthivel
Pondicherry University Pondicherry, Pondicherry-605014","28/09/2011","3 Years 0 Month",6995000.0
593.0,"BIOPESTICIDES AND CROP MANAGEMENT","Studies on interaction of plant alpha-amylase inhibitors with insect alpha-amylase [BT/PR2295/AGR/5/552/2011]","Dr. Pankaj Kautikrao Pawar
North Maharashtra University Jalgaon, Maharashtra-425001","29/08/2012","3 Years 0 Month",3441526.0
594.0,"BIOPESTICIDES AND CROP MANAGEMENT","Holistic Microbial Consortium Approach for Management of soil-borne fungal Pathogens of groundnut and Aspergillus Flavus-A post-Harvest Mycontoxin producer. [BT/PR11411/AGR/05/442/2008]","Dr. M N Reddy
Sri Padmavathi Mahila Viswa Vidyalayam Tirupati, Andhra Pradesh-517502","30/04/2010","3 Years 0 Month",3585012.0
